<?xml version="1.0" encoding="UTF-8"?>
<employee xmlns:xsi="http://www.w3.org/2001/XMLSchema-instance"
	xsi:noNamespaceSchemaLocation="http://group17.99k.org/Employee.xsd">
	<firstname>Mindy</firstname>
	<lastname>Buntler</lastname>
	<address>
		<house>1</house>
		<street>Olah Street</street>
		<postcode>W1T4JR</postcode>
		<town>London</town>
	</address>
	<phone>07834359895</phone>
	<ratetype>F</ratetype>
	<ratevalue>8</ratevalue>
	<hire>2012-12-10</hire>
	<shift>24</shift>
</employee>