<?xml version="1.0" encoding="UTF-8"?>
<employee xmlns:xsi="http://www.w3.org/2001/XMLSchema-instance"
	xsi:noNamespaceSchemaLocation="http://group17.99k.org/Employee.xsd">
	<firstname>Mayan</firstname>
	<lastname>Dang</lastname>
	<address>
		<house>12</house>
		<street>Canel Woods Road</street>
		<postcode>W1D4HZ</postcode>
		<town>London</town>
	</address>
	<phone>07845455139</phone>
	<ratetype>F</ratetype>
	<ratevalue>7.5</ratevalue>
	<hire>2012-12-10</hire>
	<shift>75</shift>
</employee>