<?xml version="1.0" encoding="UTF-8"?>
<employee xmlns:xsi="http://www.w3.org/2001/XMLSchema-instance"
	xsi:noNamespaceSchemaLocation="http://group17.99k.org/Employee.xsd">
	<firstname>Pengwei</firstname>
	<lastname>Yun</lastname>
	<address>
		<house>32</house>
		<street>Omah Street</street>
		<postcode>W1D5PH</postcode>
		<town>London</town>
	</address>
	<phone>0784425189</phone>
	<ratetype>F</ratetype>
	<ratevalue>6</ratevalue>
	<hire>2012-12-10</hire>
	<shift>43</shift>
</employee>