<?xml version="1.0" encoding="UTF-8"?>
<employee xmlns:xsi="http://www.w3.org/2001/XMLSchema-instance"
	xsi:noNamespaceSchemaLocation="http://group17.99k.org/Employee.xsd">
	<firstname>Ted</firstname>
	<lastname>Kinnison</lastname>
	<address>
		<house>46</house>
		<street>Anadel Road</street>
		<postcode>W42RA</postcode>
		<town>London</town>
	</address>
	<phone>07549223495</phone>
	<ratetype>F</ratetype>
	<ratevalue>6</ratevalue>
	<hire>2012-12-10</hire>
	<shift>11</shift>
</employee>