<?xml version="1.0" encoding="UTF-8"?>
<employee xmlns:xsi="http://www.w3.org/2001/XMLSchema-instance"
	xsi:noNamespaceSchemaLocation="http://group17.99k.org/Employee.xsd">
	<firstname>Jorge</firstname>
	<lastname>Moreno</lastname>
	<address>
		<house>32</house>
		<street>Mount Hill</street>
		<postcode>W3 8BW</postcode>
		<town>London</town>
	</address>
	<phone>02089121495</phone>
	<ratetype>F</ratetype>
	<ratevalue>7</ratevalue>
	<hire>2012-12-10</hire>
	<shift>1</shift>
</employee>