<?xml version="1.0" encoding="UTF-8"?>
<employee xmlns:xsi="http://www.w3.org/2001/XMLSchema-instance"
	xsi:noNamespaceSchemaLocation="http://group17.99k.org/Employee.xsd">
	<firstname>Mark</firstname>
	<lastname>Hunae</lastname>
	<address>
		<house>66</house>
		<street>Eten Street</street>
		<postcode>W1K1AN</postcode>
		<town>London</town>
	</address>
	<phone>07834359895</phone>
	<ratetype>F</ratetype>
	<ratevalue>7.5</ratevalue>
	<hire>2012-12-10</hire>
	<shift>51</shift>
</employee>