<?xml version="1.0" encoding="UTF-8"?>
<employee xmlns:xsi="http://www.w3.org/2001/XMLSchema-instance"
	xsi:noNamespaceSchemaLocation="http://group17.99k.org/Employee.xsd">
	<firstname>Clinton</firstname>
	<lastname>Beitz</lastname>
	<address>
		<house>23</house>
		<street>Queensbury Street</street>
		<postcode>W139TY</postcode>
		<town>London</town>
	</address>
	<phone>07433127445</phone>
	<ratetype>S</ratetype>
	<ratevalue>30</ratevalue>
	<hire>2012-12-10</hire>
	<shift>20</shift>
</employee>