<?xml version="1.0" encoding="UTF-8"?>
<employee xmlns:xsi="http://www.w3.org/2001/XMLSchema-instance"
	xsi:noNamespaceSchemaLocation="http://group17.99k.org/Employee.xsd">
	<firstname>Louis</firstname>
	<lastname>Bend</lastname>
	<address>
		<house>44</house>
		<street>Granville Place</street>
		<postcode>W84QX</postcode>
		<town>London</town>
	</address>
	<phone>07539121495</phone>
	<ratetype>F</ratetype>
	<ratevalue>8</ratevalue>
	<hire>2012-12-10</hire>
	<shift>1</shift>
</employee>