<?xml version="1.0" encoding="UTF-8"?>
<employee xmlns:xsi="http://www.w3.org/2001/XMLSchema-instance"
	xsi:noNamespaceSchemaLocation="http://group17.99k.org/Employee.xsd">
	<firstname>Odessa</firstname>
	<lastname>Perugini</lastname>
	<address>
		<house>75</house>
		<street>Roman Street</street>
		<postcode>W41LU</postcode>
		<town>London</town>
	</address>
	<phone>07884151895</phone>
	<ratetype>F</ratetype>
	<ratevalue>6</ratevalue>
	<hire>2012-12-10</hire>
	<shift>32</shift>
</employee>