<?xml version="1.0" encoding="UTF-8"?>
<employee xmlns:xsi="http://www.w3.org/2001/XMLSchema-instance"
	xsi:noNamespaceSchemaLocation="http://group17.99k.org/Employee.xsd">
	<firstname>Mike</firstname>
	<lastname>Sadur</lastname>
	<address>
		<house>54</house>
		<street>Quinse Road</street>
		<postcode>W1F7PL</postcode>
		<town>London</town>
	</address>
	<phone>07834359895</phone>
	<ratetype>F</ratetype>
	<ratevalue>7.5</ratevalue>
	<hire>2012-12-10</hire>
	<shift>13</shift>
</employee>