<?xml version="1.0" encoding="UTF-8"?>
<employee xmlns:xsi="http://www.w3.org/2001/XMLSchema-instance"
	xsi:noNamespaceSchemaLocation="http://group17.99k.org/Employee.xsd">
	<firstname>Miro</firstname>
	<lastname>Karakol</lastname>
	<address>
		<house>15</house>
		<street>Turndown Road</street>
		<postcode>W140NL</postcode>
		<town>London</town>
	</address>
	<phone>07519131495</phone>
	<ratetype>F</ratetype>
	<ratevalue>8</ratevalue>
	<hire>2012-12-10</hire>
	<shift>2</shift>
</employee>