<?xml version="1.0" encoding="UTF-8"?>
<employee xmlns:xsi="http://www.w3.org/2001/XMLSchema-instance"
	xsi:noNamespaceSchemaLocation="http://group17.99k.org/Employee.xsd">
	<firstname>Neil</firstname>
	<lastname>Havis</lastname>
	<address>
		<house>1</house>
		<street>Olah Street</street>
		<postcode>W1T4JR</postcode>
		<town>London</town>
	</address>
	<phone>07289441295</phone>
	<ratetype>S</ratetype>
	<ratevalue>30</ratevalue>
	<hire>2012-12-10</hire>
	<shift>5</shift>
</employee>